{
  "backend": "docker",
  "cases": [
    {
      "actual": "PASS",
      "case": "reference",
      "expected": "PASS",
      "template": "routing/v2-bounded-mapping-patch-confirm-1"
    },
    {
      "actual": "FAIL",
      "case": "mutant",
      "expected": "FAIL",
      "template": "routing/v2-bounded-mapping-patch-confirm-1"
    },
    {
      "actual": "PASS",
      "case": "equivalent-positive",
      "expected": "PASS",
      "template": "routing/v2-bounded-mapping-patch-confirm-1"
    },
    {
      "actual": "PASS",
      "case": "reference",
      "expected": "PASS",
      "template": "routing/v2-bounded-mapping-patch-confirm-10"
    },
    {
      "actual": "FAIL",
      "case": "mutant",
      "expected": "FAIL",
      "template": "routing/v2-bounded-mapping-patch-confirm-10"
    },
    {
      "actual": "PASS",
      "case": "equivalent-positive",
      "expected": "PASS",
      "template": "routing/v2-bounded-mapping-patch-confirm-10"
    },
    {
      "actual": "PASS",
      "case": "reference",
      "expected": "PASS",
      "template": "routing/v2-bounded-mapping-patch-confirm-11"
    },
    {
      "actual": "FAIL",
      "case": "mutant",
      "expected": "FAIL",
      "template": "routing/v2-bounded-mapping-patch-confirm-11"
    },
    {
      "actual": "PASS",
      "case": "equivalent-positive",
      "expected": "PASS",
      "template": "routing/v2-bounded-mapping-patch-confirm-11"
    },
    {
      "actual": "PASS",
      "case": "reference",
      "expected": "PASS",
      "template": "routing/v2-bounded-mapping-patch-confirm-12"
    },
    {
      "actual": "FAIL",
      "case": "mutant",
      "expected": "FAIL",
      "template": "routing/v2-bounded-mapping-patch-confirm-12"
    },
    {
      "actual": "PASS",
      "case": "equivalent-positive",
      "expected": "PASS",
      "template": "routing/v2-bounded-mapping-patch-confirm-12"
    },
    {
      "actual": "PASS",
      "case": "reference",
      "expected": "PASS",
      "template": "routing/v2-bounded-mapping-patch-confirm-2"
    },
    {
      "actual": "FAIL",
      "case": "mutant",
      "expected": "FAIL",
      "template": "routing/v2-bounded-mapping-patch-confirm-2"
    },
    {
      "actual": "PASS",
      "case": "equivalent-positive",
      "expected": "PASS",
      "template": "routing/v2-bounded-mapping-patch-confirm-2"
    },
    {
      "actual": "PASS",
      "case": "reference",
      "expected": "PASS",
      "template": "routing/v2-bounded-mapping-patch-confirm-3"
    },
    {
      "actual": "FAIL",
      "case": "mutant",
      "expected": "FAIL",
      "template": "routing/v2-bounded-mapping-patch-confirm-3"
    },
    {
      "actual": "PASS",
      "case": "equivalent-positive",
      "expected": "PASS",
      "template": "routing/v2-bounded-mapping-patch-confirm-3"
    },
    {
      "actual": "PASS",
      "case": "reference",
      "expected": "PASS",
      "template": "routing/v2-bounded-mapping-patch-confirm-4"
    },
    {
      "actual": "FAIL",
      "case": "mutant",
      "expected": "FAIL",
      "template": "routing/v2-bounded-mapping-patch-confirm-4"
    },
    {
      "actual": "PASS",
      "case": "equivalent-positive",
      "expected": "PASS",
      "template": "routing/v2-bounded-mapping-patch-confirm-4"
    },
    {
      "actual": "PASS",
      "case": "reference",
      "expected": "PASS",
      "template": "routing/v2-bounded-mapping-patch-confirm-5"
    },
    {
      "actual": "FAIL",
      "case": "mutant",
      "expected": "FAIL",
      "template": "routing/v2-bounded-mapping-patch-confirm-5"
    },
    {
      "actual": "PASS",
      "case": "equivalent-positive",
      "expected": "PASS",
      "template": "routing/v2-bounded-mapping-patch-confirm-5"
    },
    {
      "actual": "PASS",
      "case": "reference",
      "expected": "PASS",
      "template": "routing/v2-bounded-mapping-patch-confirm-6"
    },
    {
      "actual": "FAIL",
      "case": "mutant",
      "expected": "FAIL",
      "template": "routing/v2-bounded-mapping-patch-confirm-6"
    },
    {
      "actual": "PASS",
      "case": "equivalent-positive",
      "expected": "PASS",
      "template": "routing/v2-bounded-mapping-patch-confirm-6"
    },
    {
      "actual": "PASS",
      "case": "reference",
      "expected": "PASS",
      "template": "routing/v2-bounded-mapping-patch-confirm-7"
    },
    {
      "actual": "FAIL",
      "case": "mutant",
      "expected": "FAIL",
      "template": "routing/v2-bounded-mapping-patch-confirm-7"
    },
    {
      "actual": "PASS",
      "case": "equivalent-positive",
      "expected": "PASS",
      "template": "routing/v2-bounded-mapping-patch-confirm-7"
    },
    {
      "actual": "PASS",
      "case": "reference",
      "expected": "PASS",
      "template": "routing/v2-bounded-mapping-patch-confirm-8"
    },
    {
      "actual": "FAIL",
      "case": "mutant",
      "expected": "FAIL",
      "template": "routing/v2-bounded-mapping-patch-confirm-8"
    },
    {
      "actual": "PASS",
      "case": "equivalent-positive",
      "expected": "PASS",
      "template": "routing/v2-bounded-mapping-patch-confirm-8"
    },
    {
      "actual": "PASS",
      "case": "reference",
      "expected": "PASS",
      "template": "routing/v2-bounded-mapping-patch-confirm-9"
    },
    {
      "actual": "FAIL",
      "case": "mutant",
      "expected": "FAIL",
      "template": "routing/v2-bounded-mapping-patch-confirm-9"
    },
    {
      "actual": "PASS",
      "case": "equivalent-positive",
      "expected": "PASS",
      "template": "routing/v2-bounded-mapping-patch-confirm-9"
    },
    {
      "actual": "PASS",
      "case": "reference",
      "expected": "PASS",
      "template": "routing/v2-bounded-mapping-patch-development-a"
    },
    {
      "actual": "FAIL",
      "case": "mutant",
      "expected": "FAIL",
      "template": "routing/v2-bounded-mapping-patch-development-a"
    },
    {
      "actual": "PASS",
      "case": "equivalent-positive",
      "expected": "PASS",
      "template": "routing/v2-bounded-mapping-patch-development-a"
    },
    {
      "actual": "PASS",
      "case": "reference",
      "expected": "PASS",
      "template": "routing/v2-bounded-mapping-patch-development-b"
    },
    {
      "actual": "FAIL",
      "case": "mutant",
      "expected": "FAIL",
      "template": "routing/v2-bounded-mapping-patch-development-b"
    },
    {
      "actual": "PASS",
      "case": "equivalent-positive",
      "expected": "PASS",
      "template": "routing/v2-bounded-mapping-patch-development-b"
    },
    {
      "actual": "PASS",
      "case": "reference",
      "expected": "PASS",
      "template": "routing/v2-coordination-integration-confirm-1"
    },
    {
      "actual": "FAIL",
      "case": "mutant",
      "expected": "FAIL",
      "template": "routing/v2-coordination-integration-confirm-1"
    },
    {
      "actual": "PASS",
      "case": "equivalent-positive",
      "expected": "PASS",
      "template": "routing/v2-coordination-integration-confirm-1"
    },
    {
      "actual": "FAIL",
      "case": "schema-extra-mutant",
      "expected": "FAIL",
      "template": "routing/v2-coordination-integration-confirm-1"
    },
    {
      "actual": "PASS",
      "case": "reference",
      "expected": "PASS",
      "template": "routing/v2-coordination-integration-confirm-10"
    },
    {
      "actual": "FAIL",
      "case": "mutant",
      "expected": "FAIL",
      "template": "routing/v2-coordination-integration-confirm-10"
    },
    {
      "actual": "PASS",
      "case": "equivalent-positive",
      "expected": "PASS",
      "template": "routing/v2-coordination-integration-confirm-10"
    },
    {
      "actual": "FAIL",
      "case": "schema-extra-mutant",
      "expected": "FAIL",
      "template": "routing/v2-coordination-integration-confirm-10"
    },
    {
      "actual": "PASS",
      "case": "reference",
      "expected": "PASS",
      "template": "routing/v2-coordination-integration-confirm-11"
    },
    {
      "actual": "FAIL",
      "case": "mutant",
      "expected": "FAIL",
      "template": "routing/v2-coordination-integration-confirm-11"
    },
    {
      "actual": "PASS",
      "case": "equivalent-positive",
      "expected": "PASS",
      "template": "routing/v2-coordination-integration-confirm-11"
    },
    {
      "actual": "FAIL",
      "case": "schema-extra-mutant",
      "expected": "FAIL",
      "template": "routing/v2-coordination-integration-confirm-11"
    },
    {
      "actual": "PASS",
      "case": "reference",
      "expected": "PASS",
      "template": "routing/v2-coordination-integration-confirm-12"
    },
    {
      "actual": "FAIL",
      "case": "mutant",
      "expected": "FAIL",
      "template": "routing/v2-coordination-integration-confirm-12"
    },
    {
      "actual": "PASS",
      "case": "equivalent-positive",
      "expected": "PASS",
      "template": "routing/v2-coordination-integration-confirm-12"
    },
    {
      "actual": "FAIL",
      "case": "schema-extra-mutant",
      "expected": "FAIL",
      "template": "routing/v2-coordination-integration-confirm-12"
    },
    {
      "actual": "PASS",
      "case": "reference",
      "expected": "PASS",
      "template": "routing/v2-coordination-integration-confirm-2"
    },
    {
      "actual": "FAIL",
      "case": "mutant",
      "expected": "FAIL",
      "template": "routing/v2-coordination-integration-confirm-2"
    },
    {
      "actual": "PASS",
      "case": "equivalent-positive",
      "expected": "PASS",
      "template": "routing/v2-coordination-integration-confirm-2"
    },
    {
      "actual": "FAIL",
      "case": "schema-extra-mutant",
      "expected": "FAIL",
      "template": "routing/v2-coordination-integration-confirm-2"
    },
    {
      "actual": "PASS",
      "case": "reference",
      "expected": "PASS",
      "template": "routing/v2-coordination-integration-confirm-3"
    },
    {
      "actual": "FAIL",